{
  "id": "openclaw-workspace",
  "name": "OpenClaw Workspace",
  "version": "0.1.0",
  "description": "Surface OpenClaw memory files and artifacts directly inside Lumina.",
  "entry": "index.js",
  "permissions": [
    "commands:register",
    "editor:read",
    "events:subscribe",
    "ui:decorate",
    "ui:notify",
    "workspace:integrations",
    "workspace:open",
    "workspace:tab",
    "vault:list",
    "vault:read",
    "vault:write"
  ],
  "enabled_by_default": true
}
